{
  "scenario_id": "eindhoven_corridor",
  "name": "Eindhoven Corridor Advance",
  "description": "US 101st Airborne secures the corridor through Eindhoven, linking up with XXX Corps advancing from the south",
  "map_id": "eindhoven",
  "time_of_day": "day",
  "weather": "overcast",
  "day": 2,
  "sector": "eindhoven",
  "operation_id": "eindhoven_corridor",
  "forces": {
    "allies": {
      "faction": "AMERICAN",
      "deployment_zone": {"x_min": 0, "x_max": 12, "y_min": 0, "y_max": 40},
      "units": [
        {"template_id": "us_para_rifle_squad_101st", "count": 4, "deployment_cost": 100},
        {"template_id": "us_para_mg_30cal", "count": 2, "deployment_cost": 150},
        {"template_id": "us_para_at_bazooka", "count": 1, "deployment_cost": 200},
        {"template_id": "us_para_mortar_60mm", "count": 1, "deployment_cost": 180}
      ],
      "reinforcements": [
        {"template_id": "uk_xxx_cors_sherman", "arrival_turn": 6, "from_direction": "south"},
        {"template_id": "us_para_rifle_squad_101st", "arrival_turn": 4, "from_direction": "south"}
      ],
      "max_infantry": 9,
      "max_support": 6
    },
    "axis": {
      "faction": "GERMAN",
      "deployment_zone": {"x_min": 30, "x_max": 42, "y_min": 0, "y_max": 40},
      "units": [
        {"template_id": "de_grenadier_squad", "count": 3, "deployment_cost": 100},
        {"template_id": "de_mg42_squad", "count": 1, "deployment_cost": 150},
        {"template_id": "de_pak40_at_gun", "count": 1, "deployment_cost": 280},
        {"template_id": "de_sp_recon", "count": 1, "deployment_cost": 250}
      ],
      "reinforcements": [
        {"template_id": "de_grenadier_squad", "arrival_turn": 5, "from_direction": "east"},
        {"template_id": "de_stug_iii", "arrival_turn": 8, "from_direction": "north"}
      ],
      "max_infantry": 9,
      "max_support": 6
    }
  },
  "victory_locations": [
    {"id": "vl_town_center", "position": [21, 20], "value": 40, "type": "building"},
    {"id": "vl_north_road", "position": [21, 8], "value": 30, "type": "road_junction"},
    {"id": "vl_south_road", "position": [21, 32], "value": 30, "type": "road_junction"},
    {"id": "vl_factory", "position": [28, 15], "value": 20, "type": "building"}
  ],
  "special_rules": ["corridor_must_remain_open", "xxx_corps_linkup", "limited_air_support"]
}
