{
  "scenario_id": "eindhoven_linkup",
  "name": "Eindhoven Linkup - Day 2",
  "description": "XXX Corps advances through Eindhoven, linking up with the 101st Airborne Division which holds the northern end of the city",
  "map_id": "eindhoven_city",
  "time_of_day": "day",
  "weather": "overcast",
  "day": 2,
  "sector": "eindhoven",
  "operation_id": "eindhoven_hells_highway",
  "forces": {
    "allies": {
      "faction": "BRITISH",
      "deployment_zone": {"x_min": 0, "x_max": 12, "y_min": 25, "y_max": 42},
      "units": [
        {"template_id": "uk_xxx_cors_sherman", "count": 2, "deployment_cost": 350},
        {"template_id": "uk_xxx_cors_rifle_squad", "count": 3, "deployment_cost": 100},
        {"template_id": "uk_xxx_cors_mg", "count": 1, "deployment_cost": 150},
        {"template_id": "us_para_rifle_squad_101st", "count": 2, "deployment_cost": 100}
      ],
      "reinforcements": [
        {"template_id": "uk_xxx_cors_sherman", "arrival_turn": 4, "from_direction": "south"},
        {"template_id": "us_para_rifle_squad_101st", "arrival_turn": 3, "from_direction": "north"}
      ],
      "max_infantry": 9,
      "max_support": 6
    },
    "axis": {
      "faction": "GERMAN",
      "deployment_zone": {"x_min": 30, "x_max": 42, "y_min": 0, "y_max": 42},
      "units": [
        {"template_id": "de_grenadier_squad", "count": 3, "deployment_cost": 100},
        {"template_id": "de_mg42_squad", "count": 2, "deployment_cost": 150},
        {"template_id": "de_pak40_at_gun", "count": 1, "deployment_cost": 280},
        {"template_id": "de_sp_recon", "count": 1, "deployment_cost": 250}
      ],
      "reinforcements": [
        {"template_id": "de_stug_iii", "arrival_turn": 6, "from_direction": "east"},
        {"template_id": "de_grenadier_squad", "arrival_turn": 5, "from_direction": "north"}
      ],
      "max_infantry": 9,
      "max_support": 6
    }
  },
  "victory_locations": [
    {"id": "vl_city_center", "position": [21, 21], "value": 40, "type": "building"},
    {"id": "vl_north_road", "position": [21, 8], "value": 30, "type": "road_junction"},
    {"id": "vl_south_road", "position": [21, 34], "value": 30, "type": "road_junction"}
  ],
  "special_rules": ["corridor_must_remain_open", "xxx_corps_linkup", "limited_air_support"]
}
